{
  "schema": "vesperare.max_harness.command.v0",
  "command_id": "cmd-request-state-sample-001",
  "run_id": "run-sample-state-001",
  "issued_by": "codex_cli",
  "created_at": "2026-07-01T00:00:00Z",
  "type": "request_state",
  "target": "harness",
  "mode": "active",
  "payload": {},
  "expect_ack": true,
  "notes": "Sample request_state command for local file-only harness validation."
}
